kind;title;htmlTitle;link;displayLink;snippet;htmlSnippet;formattedUrl;htmlFormattedUrl;pagemap;mime;fileFormat
customsearch#result;Mendocann 2025: Godoy Cruz, punto de encuentro para el ...;Mendocann <b>2025</b>: Godoy Cruz, punto de encuentro para el ...;https://www.godoycruz.gob.ar/mendocann-2025-godoy-cruz-punto-encuentro-ecosistema-cannabico/;www.godoycruz.gob.ar;11 abr 2025 ... Su participación subraya el respaldo institucional que acompaña el desarrollo de esta industria en Mendoza. En la apertura de la Expo ...;"11 abr 2025 <b>...</b> Su participación subraya el respaldo institucional que acompaña el desarrollo de esta industria en <b>Mendoza</b>. En la apertura de la <b>Expo</b>&nbsp;...";https://www.godoycruz.gob.ar/mendocann-2025-godoy-cruz-punto-encue...;https://www.godoycruz.gob.ar/mendocann-<b>2025</b>-godoy-cruz-punto-encue...;{'cse_thumbnail': [{'src': 'https://encrypted-tbn0.gstatic.com/images?q=tbn:ANd9GcSncRsLeAsLJ9PKqUdQE31i4PUw878FyH9ZHT9sZ9y4AWxRVsJJeqfOxnU&s', 'width': '259', 'height': '194'}], 'metatags': [{'og:image': 'https://www.godoycruz.gob.ar/wp-content/uploads/2025/04/mendocann-2025.jpeg', 'og:type': 'article', 'article:section': 'Destacado', 'article:published_time': '2025-04-11T16:00:08+00:00', 'og:image:width': '4160', 'twitter:card': 'summary', 'twitter:title': 'Mendocann 2025: Godoy Cruz, punto de encuentro para el ecosistema cannábico - Godoy Cruz', 'og:site_name': 'Godoy Cruz', 'tec-api-origin': 'https://www.godoycruz.gob.ar', 'og:title': 'Mendocann 2025: Godoy Cruz, punto de encuentro para el ecosistema cannábico - Godoy Cruz', 'og:image:height': '3120', 'og:updated_time': '2025-04-11T16:00:53+00:00', 'msapplication-tileimage': 'https://www.godoycruz.gob.ar/wp-content/uploads/2024/10/cropped-cropped-faviconN-512x512-270x270.png', 'twitter:image': 'https://www.godoycruz.gob.ar/wp-content/uploads/2025/04/mendocann-2025.jpeg', 'article:tag': 'Diego Costarelli', 'article:modified_time': '2025-04-11T16:00:53+00:00', 'viewport': 'width=device-width, initial-scale=1', 'og:locale': 'es_ES', 'og:url': 'https://www.godoycruz.gob.ar/mendocann-2025-godoy-cruz-punto-encuentro-ecosistema-cannabico/', 'tec-api-version': 'v1'}], 'cse_image': [{'src': 'https://www.godoycruz.gob.ar/wp-content/uploads/2025/04/mendocann-2025.jpeg'}]};;
customsearch#result;Se lanza la 8° Edición del Festival Audiovisual Latinoamericano ...;Se lanza la 8° Edición del Festival Audiovisual Latinoamericano ...;https://www.mendoza.edu.ar/se-lanza-la-8-edicion-del-festival-audiovisual-latinoamericano-ser-voz-las-historias-cobran-vida/;www.mendoza.edu.ar;22 abr 2025 ... Se realizará el circuito de exhibición ... Más noticias educativas. El Gobierno de Mendoza premió a estudiantes ganadores del Concurso IDEAGUA ...;"22 abr 2025 <b>...</b> Se realizará el circuito de exhibición ... Más noticias educativas. El Gobierno de <b>Mendoza</b> premió a estudiantes ganadores del Concurso IDEAGUA&nbsp;...";https://www.mendoza.edu.ar/se-lanza-la-8-edicion-del-festival-audiovisual-l...;https://www.<b>mendoza</b>.edu.ar/se-lanza-la-8-edicion-del-festival-audiovisual-l...;{'metatags': [{'og:image': 'https://www.mendoza.edu.ar/wp-content/uploads/2025/04/festival-ser-voz_8va-edicion_educacion-artistica-1.jpeg', 'og:type': 'article', 'viewport': 'width=device-width, initial-scale=1', 'og:title': 'Se lanza la 8° Edición del Festival Audiovisual Latinoamericano SER VOZ “Las historias cobran vida”', 'og:url': 'https://www.mendoza.edu.ar/se-lanza-la-8-edicion-del-festival-audiovisual-latinoamericano-ser-voz-las-historias-cobran-vida/', 'og:description': 'Esta nueva edición busca incentivar la lectura y la identidad cultural mendocina a través del cine, invitando a las escuelas de nivel medio, en sus diversas modalidades y a las Escuelas Artísticas Vocacionales, a presentar cortometrajes basados en cuentos, relatos, mitos y leyendas de autores mendocinos. El 8vo Festival Audiovisual Latinoamericano Ser Voz, denominado «Las […]', 'dlm-version': '5.1.6'}]};;
customsearch#result;Bienvenido a La Paz Municipio;Bienvenido a La Paz Municipio;https://lapazmendoza.gob.ar/;lapazmendoza.gob.ar;Página oficial del Municipio de La Paz, cuyo centro cívico se encuentra ubicado en calle Belgrano y Galigniana 5590, Villa Cabecera La Paz, Mendoza, ...;"Página oficial del Municipio de La Paz, cuyo centro cívico se encuentra ubicado en calle Belgrano y Galigniana 5590, Villa Cabecera La Paz, <b>Mendoza</b>,&nbsp;...";https://lapazmendoza.gob.ar/;https://lapaz<b>mendoza</b>.gob.ar/;{'cse_thumbnail': [{'src': 'https://encrypted-tbn0.gstatic.com/images?q=tbn:ANd9GcSFsso_1SW--4sjrRV5Hv9jBtMOe3-q8bwIh725HjeeHBWWFACNIoAJyfU&s', 'width': '194', 'height': '259'}], 'metatags': [{'og:image': 'https://lapazmendoza.gob.ar/wp-content/uploads/2021/11/cropped-Logo-Horizontal-PNG-1.png', 'og:type': 'article', 'article:published_time': '2024-10-13T11:16:25+00:00', 'twitter:card': 'summary', 'twitter:title': 'Bienvenido a La Paz Municipio', 'og:site_name': 'Municipalidad de La Paz - Visitá el Portal de Mendoza', 'og:title': 'Bienvenido a La Paz Municipio', 'msapplication-tileimage': 'https://lapazmendoza.gob.ar/wp-content/uploads/2020/06/cropped-web-lapaz-ico-04-270x270.png', 'og:description': 'Página oficial del Municipio de La Paz, cuyo centro cívico se encuentra ubicado en calle Belgrano y Galigniana 5590, Villa Cabecera La Paz, Mendoza, Argentina.', 'og:image:secure_url': 'https://lapazmendoza.gob.ar/wp-content/uploads/2021/11/cropped-Logo-Horizontal-PNG-1.png', 'twitter:image': 'https://lapazmendoza.gob.ar/wp-content/uploads/2021/11/cropped-Logo-Horizontal-PNG-1.png', 'article:modified_time': '2025-07-29T21:04:56+00:00', 'viewport': 'width=device-width, initial-scale=1', 'twitter:description': 'Página oficial del Municipio de La Paz, cuyo centro cívico se encuentra ubicado en calle Belgrano y Galigniana 5590, Villa Cabecera La Paz, Mendoza, Argentina.', 'og:locale': 'es_ES', 'og:url': 'https://lapazmendoza.gob.ar/'}], 'cse_image': [{'src': 'https://lapazmendoza.gob.ar/wp-content/uploads/2021/11/cropped-Logo-Horizontal-PNG-1.png'}]};;
customsearch#result;Godoy Cruz será epicentro mundial del vino con Vinexpo Explorer ...;Godoy Cruz será epicentro mundial del vino con Vinexpo Explorer ...;https://www.godoycruz.gob.ar/godoy-cruz-sera-epicentro-mundial-del-vino-vinexpo-explorer-mendoza-2025/;www.godoycruz.gob.ar;23 abr 2025 ... Es que, el emblemático lugar será sede de Vinexpo Explorer Mendoza 2025, uno de los encuentros más estratégicos de la industria vitivinícola a ...;"23 abr 2025 <b>...</b> Es que, el emblemático lugar será sede de Vinexpo Explorer <b>Mendoza 2025</b>, uno de los encuentros más estratégicos de la industria vitivinícola a&nbsp;...";https://www.godoycruz.gob.ar/godoy-cruz-sera-epicentro-mundial-del-vin...;https://www.godoycruz.gob.ar/godoy-cruz-sera-epicentro-mundial-del-vin...;{'cse_thumbnail': [{'src': 'https://encrypted-tbn0.gstatic.com/images?q=tbn:ANd9GcQgjzEVnwXtnat7i8-58ELgaki3uXzYZaLd3MN_SBDkY3ZtPwLOsY1sd_k&s', 'width': '252', 'height': '200'}], 'metatags': [{'og:image': 'https://www.godoycruz.gob.ar/wp-content/uploads/2025/04/Arizu-expo-winw-2025-portada.png', 'og:type': 'article', 'article:section': 'Destacado', 'article:published_time': '2025-04-23T10:58:39+00:00', 'og:image:width': '788', 'twitter:card': 'summary', 'twitter:title': 'Godoy Cruz será epicentro mundial del vino con Vinexpo Explorer Mendoza 2025 - Godoy Cruz', 'og:site_name': 'Godoy Cruz', 'tec-api-origin': 'https://www.godoycruz.gob.ar', 'og:title': 'Godoy Cruz será epicentro mundial del vino con Vinexpo Explorer Mendoza 2025 - Godoy Cruz', 'og:image:height': '624', 'og:updated_time': '2025-10-01T10:38:18+00:00', 'msapplication-tileimage': 'https://www.godoycruz.gob.ar/wp-content/uploads/2024/10/cropped-cropped-faviconN-512x512-270x270.png', 'twitter:image': 'https://www.godoycruz.gob.ar/wp-content/uploads/2025/04/Arizu-expo-winw-2025-portada.png', 'article:tag': 'con identidad vitivinícola y visión global', 'article:modified_time': '2025-10-01T10:38:18+00:00', 'viewport': 'width=device-width, initial-scale=1', 'og:locale': 'es_ES', 'og:url': 'https://www.godoycruz.gob.ar/godoy-cruz-sera-epicentro-mundial-del-vino-vinexpo-explorer-mendoza-2025/', 'tec-api-version': 'v1'}], 'cse_image': [{'src': 'https://www.godoycruz.gob.ar/wp-content/uploads/2025/04/Arizu-expo-winw-2025-portada.png'}]};;
customsearch#result;Inscripción - Wicc 2025;Inscripción - Wicc <b>2025</b>;https://ingenieria.uncuyo.edu.ar/wicc2025/inscripcion;ingenieria.uncuyo.edu.ar;Para poder imprimir el poster en Mendoza, solicitamos que se contacten a ... Teniendo en cuenta que, previa a la exposición presencial de los póster ...;"Para poder imprimir el poster en <b>Mendoza</b>, solicitamos que se contacten a ... Teniendo en cuenta que, previa a la <b>exposición</b> presencial de los póster&nbsp;...";https://ingenieria.uncuyo.edu.ar/wicc2025/inscripcion;https://ingenieria.uncuyo.edu.ar/wicc<b>2025</b>/inscripcion;{'cse_thumbnail': [{'src': 'https://encrypted-tbn0.gstatic.com/images?q=tbn:ANd9GcS41ep6NI3NTHWmeLP8XrWjwhIna7IM1TS3wVEOSdS0E6gJkminpBIoUgY&s', 'width': '310', 'height': '163'}], 'metatags': [{'msapplication-tilecolor': '#263238', 'og:image': 'https://ingenieria.uncuyo.edu.ar/wicc2025/cache/1ee4fbc076ab11342845a672b8d192be_315_600_c.jpg', 'og:type': 'website', 'twitter:card': 'summary_large_image', 'twitter:title': 'Inscripción', 'theme-color': '#263238', 'og:site_name': 'Wicc 2025', 'author': 'Wicc 2025', 'og:title': 'Inscripción', 'msapplication-tileimage': 'https://prueba.uncuyo.edu.ar/modular_4/mstile-144x144.png', 'og:description': 'Universidad Nacional de Cuyo, carreras, estudios e investigación.', 'twitter:creator': 'Wicc 2025', 'twitter:image:src': 'https://ingenieria.uncuyo.edu.ar/wicc2025/cache/1ee4fbc076ab11342845a672b8d192be_315_600_c.jpg', 'fb:app_id': '220667188060569', 'twitter:site': 'Wicc 2025', 'viewport': 'width=device-width, initial-scale=1', 'twitter:description': 'Universidad Nacional de Cuyo, carreras, estudios e investigación.', 'og:url': 'https://ingenieria.uncuyo.edu.ar/wicc2025/inscripcion'}], 'cse_image': [{'src': 'https://ingenieria.uncuyo.edu.ar/wicc2025/cache/1ee4fbc076ab11342845a672b8d192be_315_600_c.jpg'}]};;
customsearch#result;Cornejo: “Esta nueva industria representa una oportunidad para ...;Cornejo: “Esta nueva industria representa una oportunidad para ...;https://www.mendoza.gov.ar/prensa/cornejo-esta-nueva-industria-representa-una-oportunidad-para-mendoza-y-para-el-pais/;www.mendoza.gov.ar;11 DE ABRIL, 2025. En el marco de la Expo Mendocann, el Gobernador realizó los anuncios y le dio un fuerte impulso a esta nueva industria que abre la ...;"11 DE ABRIL, <b>2025</b>. En el marco de la <b>Expo</b> Mendocann, el Gobernador realizó los anuncios y le dio un fuerte impulso a esta nueva industria que abre la&nbsp;...";https://www.mendoza.gov.ar/.../cornejo-esta-nueva-industria-representa-un...;https://www.<b>mendoza</b>.gov.ar/.../cornejo-esta-nueva-industria-representa-un...;{'cse_thumbnail': [{'src': 'https://encrypted-tbn0.gstatic.com/images?q=tbn:ANd9GcTpCWeA_bxU_H6YeIeAVI3zmCEM-awWshP7Ty1T4fXPGs8ikHeI6DWuV9Q&s', 'width': '274', 'height': '184'}], 'metatags': [{'viewport': 'width=device-width, initial-scale=1.0'}], 'cse_image': [{'src': 'https://www.mendoza.gov.ar/wp-content/uploads/sites/5/2025/04/DSC08619-700x471.jpg'}]};;
customsearch#result;Se viene la Expo Educativa 2019 - Facultad de Ciencias Políticas y ...;Se viene la <b>Expo</b> Educativa 2019 - Facultad de Ciencias Políticas y ...;https://fcp.uncuyo.edu.ar/se-viene-la-expo-educativa-2019;fcp.uncuyo.edu.ar;22 abr 2025 ... La expo educativa 2019, tendrá lugar en el complejo nave cultural de la ciudad de Mendoza el 12 y 13 de junio de 9 a 18 hs y el 14 de junio ...;"22 abr 2025 <b>...</b> La <b>expo</b> educativa 2019, tendrá lugar en el complejo nave cultural de la ciudad de <b>Mendoza</b> el 12 y 13 de junio de 9 a 18 hs y el 14 de junio&nbsp;...";https://fcp.uncuyo.edu.ar/se-viene-la-expo-educativa-2019;https://fcp.uncuyo.edu.ar/se-viene-la-expo-educativa-2019;{'cse_thumbnail': [{'src': 'https://encrypted-tbn0.gstatic.com/images?q=tbn:ANd9GcT0dDd_HWCPzGpzgfADISWCiUIAXknmILjkASu5Nf2SiDeSeuzOq6ZjDMdX&s', 'width': '310', 'height': '163'}], 'metatags': [{'msapplication-tilecolor': '#263238', 'og:image': 'https://fcp.uncuyo.edu.ar/cache/expo1_315_600_c.jpg', 'og:type': 'website', 'twitter:card': 'summary_large_image', 'twitter:title': 'Se viene la Expo Educativa 2019', 'theme-color': '#263238', 'og:site_name': 'Facultad de Ciencias Políticas y Sociales', 'author': 'Facultad de Ciencias Políticas y Sociales', 'og:title': 'Se viene la Expo Educativa 2019', 'msapplication-tileimage': 'https://prueba.uncuyo.edu.ar/modular_4/mstile-144x144.png', 'og:description': 'La expo educativa 2019, tendrá lugar en el complejo  nave cultural de la ciudad de Mendoza el 12 y 13 de junio  de 9 a 18 hs y  el 14 de junio de 9 a 14 hs.', 'twitter:creator': 'Facultad de Ciencias Políticas y Sociales', 'twitter:image:src': 'https://fcp.uncuyo.edu.ar/cache/expo1_315_600_c.jpg', 'fb:app_id': '220667188060569', 'twitter:site': 'Facultad de Ciencias Políticas y Sociales', 'viewport': 'width=device-width, initial-scale=1', 'twitter:description': 'La expo educativa 2019, tendrá lugar en el complejo  nave cultural de la ciudad de Mendoza el 12 y 13 de junio  de 9 a 18 hs y  el 14 de ...', 'og:url': 'https://fcp.uncuyo.edu.ar/se-viene-la-expo-educativa-2019'}], 'cse_image': [{'src': 'https://fcp.uncuyo.edu.ar/cache/expo1_315_600_c.jpg'}]};;
customsearch#result;El Mendoza Hat Walk llenó el parque de caminantes con sombreros ...;El <b>Mendoza</b> Hat Walk llenó el parque de caminantes con sombreros ...;https://www.mendoza.gov.ar/prensa/el-mendoza-hat-walk-lleno-el-parque-de-caminantes-con-sombreros-y-colores/;www.mendoza.gov.ar;28 abr 2025 ... ... exposición y numerosas actividades. El domingo 27, Mendoza se sumó por primera vez al World Hat Walk, un evento global que celebra la ...;"28 abr 2025 <b>...</b> ... <b>exposición</b> y numerosas actividades. El domingo 27, <b>Mendoza</b> se sumó por primera vez al World Hat Walk, un evento global que celebra la&nbsp;...";https://www.mendoza.gov.ar/.../el-mendoza-hat-walk-lleno-el-parque-de-ca...;https://www.<b>mendoza</b>.gov.ar/.../el-<b>mendoza</b>-hat-walk-lleno-el-parque-de-ca...;{'cse_thumbnail': [{'src': 'https://encrypted-tbn0.gstatic.com/images?q=tbn:ANd9GcRaU_Z22J3TCBfBPdGafhaen9a7kAGmkvORz7estkn-lvHeZkkM23NyoS0&s', 'width': '273', 'height': '185'}], 'metatags': [{'viewport': 'width=device-width, initial-scale=1.0'}], 'cse_image': [{'src': 'https://www.mendoza.gov.ar/wp-content/uploads/sites/5/2025/04/DSC_8130-700x474.jpg'}]};;
customsearch#result;Cornejo presentó el Pasaporte Nacional Sanmartiniano en Mendoza;Cornejo presentó el Pasaporte Nacional Sanmartiniano en <b>Mendoza</b>;https://www.mendoza.gov.ar/prensa/cornejo-presento-el-pasaporte-nacional-sanmartiniano-en-mendoza/;www.mendoza.gov.ar;22 DE ABRIL, 2025. La iniciativa, que forma parte del programa Caminos de la Libertad, busca revalorizar el legado del General San Martín y promover el ...;"22 DE ABRIL, <b>2025</b>. La iniciativa, que forma parte del programa Caminos de la Libertad, busca revalorizar el legado del General San Martín y promover el&nbsp;...";https://www.mendoza.gov.ar/.../cornejo-presento-el-pasaporte-nacional-san...;https://www.<b>mendoza</b>.gov.ar/.../cornejo-presento-el-pasaporte-nacional-san...;{'metatags': [{'viewport': 'width=device-width, initial-scale=1.0'}]};;
customsearch#result;Mendoza fue sede del Seminario Internacional de Cerezas Frescas ...;<b>Mendoza</b> fue sede del <b>Seminario</b> Internacional de Cerezas Frescas ...;https://www.mendoza.gov.ar/prensa/mendoza-fue-sede-del-seminario-internacional-de-cerezas-frescas-tempranas-2025/;www.mendoza.gov.ar;3 DE ABRIL, 2025. El encuentro fue organizado por la Cámara de Cerezas de Mendoza, junto al Ministerio de Producción, a través de la Dirección de ...;"3 DE ABRIL, <b>2025</b>. El encuentro fue organizado por la Cámara de Cerezas de <b>Mendoza</b>, junto al Ministerio de Producción, a través de la Dirección de&nbsp;...";https://www.mendoza.gov.ar/.../mendoza-fue-sede-del-seminario-internacio...;https://www.<b>mendoza</b>.gov.ar/.../<b>mendoza</b>-fue-sede-del-<b>seminario</b>-internacio...;{'metatags': [{'viewport': 'width=device-width, initial-scale=1.0'}]};;
customsearch#result;Colegio de Arquitectos Mendoza: Seminario sobre Dibujos y ...;Colegio de Arquitectos <b>Mendoza</b>: <b>Seminario</b> sobre Dibujos y ...;https://www.ucongreso.edu.ar/colegio-de-arquitectos-mendoza-seminario-sobre-dibujos-y-arquitectura/;www.ucongreso.edu.ar;Colegio de Arquitectos Mendoza: Seminario sobre Dibujos y Arquitectura. 14 abril, 2025. La Facultad de Ambiente, Arquitectura y Urbanismo invita docentes, ...;"Colegio de Arquitectos <b>Mendoza</b>: <b>Seminario</b> sobre Dibujos y Arquitectura. 14 abril, <b>2025</b>. La Facultad de Ambiente, Arquitectura y Urbanismo invita docentes,&nbsp;...";https://www.ucongreso.edu.ar/colegio-de-arquitectos-mendoza-seminario-s...;https://www.ucongreso.edu.ar/colegio-de-arquitectos-<b>mendoza</b>-<b>seminario</b>-s...;{'cse_thumbnail': [{'src': 'https://encrypted-tbn0.gstatic.com/images?q=tbn:ANd9GcRn9UOEUdPLTZhxiWhKFS31PryiyuvOR7Tzoy1zTyOxQeBK5jAo9NEFZea3&s', 'width': '317', 'height': '159'}], 'metatags': [{'og:image': 'http://www.ucongreso.edu.ar/wp-content/uploads/2025/04/Seminario-Dibujando-Arquitectura.jpeg', 'article:published_time': '2025-04-14T17:25:43+00:00', 'og:image:width': '1526', 'twitter:card': 'summary_large_image', 'theme-color': '#7BA839', 'og:site_name': 'Universidad de Congreso', 'tec-api-origin': 'https://www.ucongreso.edu.ar', 'twitter:label1': 'Written by', 'twitter:label2': 'Est. reading time', 'msapplication-tileimage': 'https://www.ucongreso.edu.ar/wp-content/themes/ucongreso/favicons/ms-icon-144x144.png', 'og:description': 'La Facultad de Ambiente, Arquitectura y Urbanismo invita docentes, estudiantes y graduados de Arquitectura a participar del Seminario de formación\xa0“Dibujando arquitectura”, dictado por el\xa0Arq. Ian Dutari, de la provincia de Córdoba, a llevarse a cabo el viernes 25 de abril a las 18 h. La jornada\xa0comienza a las 18 horas con el cursado\xa0del seminario y […]', 'twitter:creator': '@ucongreso', 'article:publisher': 'https://www.facebook.com/universidadcongreso', 'twitter:data1': 'gaticaje', 'twitter:data2': '1 minute', 'twitter:site': '@ucongreso', 'article:modified_time': '2025-04-14T17:25:47+00:00', 'tec-api-version': 'v1', 'msapplication-tilecolor': '#ffffff', 'og:type': 'article', 'og:title': 'Colegio de Arquitectos Mendoza: Seminario sobre Dibujos y Arquitectura - Universidad de Congreso', 'og:image:height': '765', 'facebook-domain-verification': 'xadv5twktycpo86aqgafo0firtwz87', 'viewport': 'width=device-width, initial-scale=1.0', 'og:locale': 'es_ES', 'og:url': 'https://www.ucongreso.edu.ar/colegio-de-arquitectos-mendoza-seminario-sobre-dibujos-y-arquitectura/'}], 'cse_image': [{'src': 'http://www.ucongreso.edu.ar/wp-content/uploads/2025/04/Seminario-Dibujando-Arquitectura.jpeg'}]};;
customsearch#result;Seminario sobre el “Proceso de creación teatral en espacios ...;<b>Seminario</b> sobre el “Proceso de creación teatral en espacios ...;https://www.mendoza.gov.ar/prensa/seminario-sobre-el-proceso-de-creacion-teatral-en-espacios-publicos-en-el-espacio-cultural-julio-le-parc/;www.mendoza.gov.ar;4 DE ABRIL, 2025. El seminario está destinado a personas con o sin experiencia en artes escénicas interesadas en investigar dramaturgias.;4 DE ABRIL, <b>2025</b>. El <b>seminario</b> está destinado a personas con o sin experiencia en artes escénicas interesadas en investigar dramaturgias.;https://www.mendoza.gov.ar/.../seminario-sobre-el-proceso-de-creacion-tea...;https://www.<b>mendoza</b>.gov.ar/.../<b>seminario</b>-sobre-el-proceso-de-creacion-tea...;{'cse_thumbnail': [{'src': 'https://encrypted-tbn0.gstatic.com/images?q=tbn:ANd9GcTO9r09vx24LCs_S8FDdyulYEZ1tSmGm0gMvoXFgSZ58SCuuy53z2aBwS_y&s', 'width': '192', 'height': '262'}], 'metatags': [{'viewport': 'width=device-width, initial-scale=1.0'}], 'cse_image': [{'src': 'https://www.mendoza.gov.ar/wp-content/uploads/sites/5/2025/04/Mariela-Rigano.jpeg'}]};;
customsearch#result;Abogacía: Seminarios de Inglés - Universidad de Congreso ...;Abogacía: <b>Seminarios</b> de Inglés - Universidad de Congreso ...;https://www.ucongreso.edu.ar/abogacia-seminarios-de-ingles/;www.ucongreso.edu.ar;Abogacía: Seminarios de Inglés. 16 abril, 2025. La Facultad de Ciencias ... Mendoza: Fotos Acto de Colación 2025. Mendoza: Fotos Acto de Colación 2025.;Abogacía: <b>Seminarios</b> de Inglés. 16 abril, <b>2025</b>. La Facultad de Ciencias ... <b>Mendoza</b>: Fotos Acto de Colación <b>2025</b>. <b>Mendoza</b>: Fotos Acto de Colación <b>2025</b>.;https://www.ucongreso.edu.ar/abogacia-seminarios-de-ingles/;https://www.ucongreso.edu.ar/abogacia-<b>seminario</b>s-de-ingles/;{'cse_thumbnail': [{'src': 'https://encrypted-tbn0.gstatic.com/images?q=tbn:ANd9GcSKTQl3l2iwUHdD7-R7vnW26iZ7HuV6H5JfdGDgBY-5Jj-RAMa7_kSfW4E&s', 'width': '201', 'height': '251'}], 'metatags': [{'og:image': 'http://www.ucongreso.edu.ar/wp-content/uploads/2025/04/Flyer_2025_Ingles_Juridico-01-scaled.jpg', 'article:published_time': '2025-04-16T16:27:33+00:00', 'og:image:width': '2048', 'twitter:card': 'summary_large_image', 'theme-color': '#7BA839', 'og:site_name': 'Universidad de Congreso', 'tec-api-origin': 'https://www.ucongreso.edu.ar', 'twitter:label1': 'Written by', 'twitter:label2': 'Est. reading time', 'msapplication-tileimage': 'https://www.ucongreso.edu.ar/wp-content/themes/ucongreso/favicons/ms-icon-144x144.png', 'og:description': 'La Facultad de Ciencias Jurídicas ofrece a los estudiantes de Abogacía, en todas sus Sedes, la posibilidad de inscribirse a los Seminarios de Inglés. El cursado será asincrónico, el contenido estará en la plataforma grabado, con la posibilidad de participar de las clases virtuales de forma sincrónica los días, martes de 11 a 13 hs. […]', 'twitter:creator': '@ucongreso', 'article:publisher': 'https://www.facebook.com/universidadcongreso', 'twitter:data1': 'gaticaje', 'twitter:data2': '1 minute', 'twitter:site': '@ucongreso', 'article:modified_time': '2025-04-16T16:27:36+00:00', 'tec-api-version': 'v1', 'msapplication-tilecolor': '#ffffff', 'og:type': 'article', 'og:title': 'Abogacía: Seminarios de Inglés - Universidad de Congreso', 'og:image:height': '2560', 'facebook-domain-verification': 'xadv5twktycpo86aqgafo0firtwz87', 'viewport': 'width=device-width, initial-scale=1.0', 'og:locale': 'es_ES', 'og:url': 'https://www.ucongreso.edu.ar/abogacia-seminarios-de-ingles/'}], 'cse_image': [{'src': 'http://www.ucongreso.edu.ar/wp-content/uploads/2025/04/Flyer_2025_Ingles_Juridico-01-scaled.jpg'}]};;
customsearch#result;Mendoza dice presente en el IV Seminario Internacional de Cerezas ...;<b>Mendoza</b> dice presente en el IV <b>Seminario</b> Internacional de Cerezas ...;https://www.mendoza.gov.ar/prensa/mendoza-dice-presente-en-iv-seminario-internacional-de-cerezas-primores-de-chile/;www.mendoza.gov.ar;17 DE ABRIL, 2025. Con el objetivo de fortalecer la industria, la iniciativa se lleva a cabo en la localidad de Ovalle en el vecino país.;17 DE ABRIL, <b>2025</b>. Con el objetivo de fortalecer la industria, la iniciativa se lleva a cabo en la localidad de Ovalle en el vecino país.;https://www.mendoza.gov.ar/.../mendoza-dice-presente-en-iv-seminario-int...;https://www.<b>mendoza</b>.gov.ar/.../<b>mendoza</b>-dice-presente-en-iv-<b>seminario</b>-int...;{'metatags': [{'viewport': 'width=device-width, initial-scale=1.0'}]};;
customsearch#result;PRODUCCIÓN : Prensa Gobierno de Mendoza;PRODUCCIÓN : Prensa Gobierno de <b>Mendoza</b>;https://www.mendoza.gov.ar/prensa/produccion/page/15/;www.mendoza.gov.ar;Mendoza será sede del 4° Seminario Internacional de Cerezas Frescas Tempranas 2025 · PRODUCCIÓN 29 DE MARZO, 2025. Dirigido a productores, empacadores ...;"<b>Mendoza</b> será sede del 4° <b>Seminario</b> Internacional de Cerezas Frescas Tempranas <b>2025</b> &middot; PRODUCCIÓN 29 DE MARZO, <b>2025</b>. Dirigido a productores, empacadores&nbsp;...";https://www.mendoza.gov.ar/prensa/produccion/page/15/;https://www.<b>mendoza</b>.gov.ar/prensa/produccion/page/15/;{'cse_thumbnail': [{'src': 'https://encrypted-tbn0.gstatic.com/images?q=tbn:ANd9GcTcfI5mQjShYMXpUZan_jRCbRDkhvU4gHJbIEe2pqrIoQON4CqefxQwJBfP&s', 'width': '259', 'height': '195'}], 'metatags': [{'viewport': 'width=device-width, initial-scale=1.0'}], 'cse_image': [{'src': 'https://www.mendoza.gov.ar/wp-content/uploads/sites/5/2025/04/02-4.jpeg'}]};;
