kind;title;htmlTitle;link;displayLink;snippet;htmlSnippet;formattedUrl;htmlFormattedUrl;pagemap;mime;fileFormat
customsearch#result;El sexto Foro Gastronómico será en San Rafael : Prensa Gobierno ...;El sexto Foro Gastronómico será en San Rafael : Prensa Gobierno ...;https://www.mendoza.gov.ar/prensa/el-sexto-foro-gastronomico-sera-en-san-rafael/;www.mendoza.gov.ar;11 DE ABRIL, 2025. Desde hace varios años, la provincia de Mendoza viene trabajando para posicionarse como uno de los polos gastronómicos de Latinoamérica.;11 DE ABRIL, <b>2025</b>. Desde hace varios años, la provincia de <b>Mendoza</b> viene trabajando para posicionarse como uno de los polos gastronómicos de Latinoamérica.;https://www.mendoza.gov.ar/.../el-sexto-foro-gastronomico-sera-en-san-raf...;https://www.<b>mendoza</b>.gov.ar/.../el-sexto-foro-gastronomico-sera-en-san-raf...;{'cse_thumbnail': [{'src': 'https://encrypted-tbn0.gstatic.com/images?q=tbn:ANd9GcSp47R5Rvv3dWc-VSE7vSIr-9RDsIkgvFrwvyH1nmr0VUHQFFeu6Ck9nZhR&s', 'width': '275', 'height': '183'}], 'metatags': [{'viewport': 'width=device-width, initial-scale=1.0'}], 'cse_image': [{'src': 'https://www.mendoza.gov.ar/wp-content/uploads/sites/5/2025/04/MGR_3606-700x467.jpg'}]};;
customsearch#result;¿Querés ser parte de nuestros equipos universitarios?;¿Querés ser parte de nuestros equipos universitarios?;https://www.umaza.edu.ar/equipos-universitarios-competencias-deportivas;www.umaza.edu.ar;9 abr 2025 ... Es un evento deportivo financiado por la Subsecretaría de Deportes a ... Acceso Este, Lateral Sur 2245, Gllén, Mendoza, Argentina. C.P. ...;"9 abr 2025 <b>...</b> Es un <b>evento deportivo</b> financiado por la Subsecretaría de Deportes a ... Acceso Este, Lateral Sur 2245, Gllén, <b>Mendoza</b>, Argentina. C.P.&nbsp;...";https://www.umaza.edu.ar/equipos-universitarios-competencias-deportivas;https://www.umaza.edu.ar/equipos-universitarios-competencias-deportivas;{'cse_thumbnail': [{'src': 'https://encrypted-tbn0.gstatic.com/images?q=tbn:ANd9GcQyMJr7813ejbqb_kC7qpMH7j2SjUuKkfKyHUaDkW9JeZKrlKY5ZZmGuLc&s', 'width': '285', 'height': '177'}], 'metatags': [{'og:image': 'https://www.umaza.edu.ar/archivos/images/web-competenciasdeportivas-2023.jpg', 'og:site_name': 'Universidad Maza', 'viewport': 'width=device-width, initial-scale=1, shrink-to-fit=no', 'og:title': '¿Querés ser parte de nuestros equipos universitarios?', 'og:description': 'La Universidad Maza ha ganado 17 de las 20 Competencias Deportivas Interuniversitarias de la provincia de Mendoza. ¡Conocé las disciplinas y sumate a los planteles!', 'facebook-domain-verification': '0nwf31jra54scytv8pwdnlqbmv9hv4'}], 'cse_image': [{'src': 'https://www.umaza.edu.ar/archivos/images/web-competenciasdeportivas-2023.jpg'}]};;
customsearch#result;"Conversatorio ""Políticas ESG: Panorama 2025, ante un contexto ...";"Conversatorio &quot;Políticas ESG: Panorama <b>2025</b>, ante un contexto ...";https://derecho.uncuyo.edu.ar/conversatorio-politicas-esg-panorama-2025-ante-un-contexto-geopolitico-en-constante-cambio;derecho.uncuyo.edu.ar;7 abr 2025 ... (horario de Argentina) bajo modalidad híbrida, presencial y virtual por medio de meet. La fundamentación del evento radica en el necesario ...;"7 abr 2025 <b>...</b> (horario de Argentina) bajo modalidad híbrida, presencial y virtual por medio de meet. La fundamentación del <b>evento</b> radica en el necesario&nbsp;...";https://derecho.uncuyo.edu.ar/conversatorio-politicas-esg-panorama-2025-...;https://derecho.uncuyo.edu.ar/conversatorio-politicas-esg-panorama-<b>2025</b>-...;"{'cse_thumbnail': [{'src': 'https://encrypted-tbn0.gstatic.com/images?q=tbn:ANd9GcRj9UyA05F4PeNqYvNodADHfq6Q3csNs9Lt2d_DeEx1rIaZflJ3bhZFpDf9&s', 'width': '310', 'height': '163'}], 'metatags': [{'msapplication-tilecolor': '#263238', 'og:image': 'https://derecho.uncuyo.edu.ar/cache/64509384a2d9e2b36cb63d7cf825cbea_315_600_c.jpg', 'og:type': 'website', 'twitter:card': 'summary_large_image', 'twitter:title': 'Conversatorio ""Políticas ESG: Panorama 2025, ante un contexto geopolítico en constante cambio""', 'theme-color': '#263238', 'og:site_name': 'Facultad de Derecho', 'author': 'Facultad de Derecho', 'og:title': 'Conversatorio ""Políticas ESG: Panorama 2025, ante un contexto geopolítico en constante cambio""', 'msapplication-tileimage': 'https://prueba.uncuyo.edu.ar/modular_4/mstile-144x144.png', 'og:description': 'Con el objetivo de promover un diálogo estratégico sobre la integración de criterios ESG en empresas de la región se establece este conversatorio para identificar oportunidades, desafíos y compromisos para una gestión sostenible y responsable entre los diferentes actores públicos y privados. La actividad será libre y gratuita para público general.', 'twitter:creator': 'Facultad de Derecho', 'twitter:image:src': 'https://derecho.uncuyo.edu.ar/cache/64509384a2d9e2b36cb63d7cf825cbea_315_600_c.jpg', 'fb:app_id': '220667188060569', 'twitter:site': 'Facultad de Derecho', 'viewport': 'width=device-width, initial-scale=1', 'twitter:description': 'Con el objetivo de promover un diálogo estratégico sobre la integración de criterios ESG en empresas de la región se establece este ...', 'og:url': 'https://derecho.uncuyo.edu.ar/conversatorio-politicas-esg-panorama-2025-ante-un-contexto-geopolitico-en-constante-cambio'}], 'cse_image': [{'src': 'https://derecho.uncuyo.edu.ar/cache/64509384a2d9e2b36cb63d7cf825cbea_315_600_c.jpg'}]}";;
customsearch#result;Wicc 2025 - Mendoza;Wicc <b>2025</b> - <b>Mendoza</b>;https://ingenieria.uncuyo.edu.ar/wicc2025/;ingenieria.uncuyo.edu.ar;Wicc 2025 · Facultad de Ingenieria. » Centro Universitario » M5502JMA. Mendoza, Argentina. Tel: +54 261 4494002 · Facebook Youtube LinkedIn Instagram · Webmail ...;"Wicc <b>2025</b> &middot; Facultad de Ingenieria. » Centro Universitario » M5502JMA. <b>Mendoza</b>, Argentina. Tel: +54 261 4494002 &middot; Facebook Youtube LinkedIn Instagram &middot; Webmail&nbsp;...";https://ingenieria.uncuyo.edu.ar/wicc2025/;https://ingenieria.uncuyo.edu.ar/wicc<b>2025</b>/;{'cse_thumbnail': [{'src': 'https://encrypted-tbn0.gstatic.com/images?q=tbn:ANd9GcSCenHwEk367UoCQVapxdeklgOiKnTdhKJ3vVxZU6xtSuYGf1L2f3vQ8_k&s', 'width': '300', 'height': '168'}], 'metatags': [{'msapplication-tilecolor': '#263238', 'og:type': 'website', 'twitter:card': 'summary_large_image', 'twitter:title': 'Wicc 2025', 'theme-color': '#263238', 'og:site_name': 'Wicc 2025', 'author': 'Wicc 2025', 'og:title': 'Wicc 2025', 'msapplication-tileimage': 'https://prueba.uncuyo.edu.ar/modular_4/mstile-144x144.png', 'og:description': 'Universidad Nacional de Cuyo, carreras, estudios e investigación.', 'twitter:creator': 'Wicc 2025', 'fb:app_id': '220667188060569', 'twitter:site': 'Wicc 2025', 'viewport': 'width=device-width, initial-scale=1', 'twitter:description': 'Universidad Nacional de Cuyo, carreras, estudios e investigación.', 'og:url': 'https://ingenieria.uncuyo.edu.ar/wicc2025/'}], 'cse_image': [{'src': 'https://ingenieria.uncuyo.edu.ar/wicc2025/cache/70fef09664e933a2d770b0c4676d27c9_1200_720.png'}]};;
customsearch#result;La FCEN participará del X Simposio Internacional del Centro ...;La FCEN participará del X <b>Simposio</b> Internacional del Centro ...;https://fcen.uncuyo.edu.ar/la-fcen-participara-del-simposio-internacional-del-centro-mundial-de-estudios-humanistas;fcen.uncuyo.edu.ar;7 abr 2025 ... El evento se llevará a cabo del 8 al 11 de mayo de 2025 en modalidad virtual (a través de Zoom) y presencial en distintas locaciones del mundo, ...;"7 abr 2025 <b>...</b> El evento se llevará a cabo del 8 al 11 de mayo de <b>2025</b> en modalidad virtual (a través de Zoom) y presencial en distintas locaciones del mundo,&nbsp;...";https://fcen.uncuyo.edu.ar/la-fcen-participara-del-simposio-internacional-de...;https://fcen.uncuyo.edu.ar/la-fcen-participara-del-<b>simposio</b>-internacional-de...;{'cse_thumbnail': [{'src': 'https://encrypted-tbn0.gstatic.com/images?q=tbn:ANd9GcQPebd4qfNAUna9KjCnsqxZLryzW7rs6ynQ7hfdFbxr9pkW5iXekNcJbCbG&s', 'width': '310', 'height': '163'}], 'metatags': [{'msapplication-tilecolor': '#263238', 'og:image': 'https://fcen.uncuyo.edu.ar/cache/2bd1a667dd3cf5021a32a7b7e91b6daa_315_600_c.png', 'og:type': 'website', 'twitter:card': 'summary_large_image', 'twitter:title': 'La FCEN participará del X Simposio Internacional del Centro Mundial de Estudios Humanistas', 'theme-color': '#263238', 'og:site_name': 'FCEN - Facultad de Ciencias Exactas y Naturales', 'author': 'FCEN - Facultad de Ciencias Exactas y Naturales', 'og:title': 'La FCEN participará del X Simposio Internacional del Centro Mundial de Estudios Humanistas', 'msapplication-tileimage': 'https://prueba.uncuyo.edu.ar/modular_4/mstile-144x144.png', 'og:description': 'Universidad Nacional de Cuyo, carreras, estudios e investigación.', 'twitter:creator': 'FCEN - Facultad de Ciencias Exactas y Naturales', 'twitter:image:src': 'https://fcen.uncuyo.edu.ar/cache/2bd1a667dd3cf5021a32a7b7e91b6daa_315_600_c.png', 'fb:app_id': '220667188060569', 'twitter:site': 'FCEN - Facultad de Ciencias Exactas y Naturales', 'viewport': 'width=device-width, initial-scale=1', 'twitter:description': 'Universidad Nacional de Cuyo, carreras, estudios e investigación.', 'og:url': 'https://fcen.uncuyo.edu.ar/la-fcen-participara-del-simposio-internacional-del-centro-mundial-de-estudios-humanistas'}], 'cse_image': [{'src': 'https://fcen.uncuyo.edu.ar/cache/2bd1a667dd3cf5021a32a7b7e91b6daa_315_600_c.png'}]};;
customsearch#result;Godoy Cruz será epicentro mundial del vino con Vinexpo Explorer ...;Godoy Cruz será epicentro mundial del vino con Vinexpo Explorer ...;https://www.godoycruz.gob.ar/godoy-cruz-sera-epicentro-mundial-del-vino-vinexpo-explorer-mendoza-2025/;www.godoycruz.gob.ar;23 abr 2025 ... Es que, el emblemático lugar será sede de Vinexpo Explorer Mendoza 2025, uno de los encuentros más estratégicos de la industria vitivinícola a ...;"23 abr 2025 <b>...</b> Es que, el emblemático lugar será sede de Vinexpo Explorer <b>Mendoza 2025</b>, uno de los encuentros más estratégicos de la industria vitivinícola a&nbsp;...";https://www.godoycruz.gob.ar/godoy-cruz-sera-epicentro-mundial-del-vin...;https://www.godoycruz.gob.ar/godoy-cruz-sera-epicentro-mundial-del-vin...;{'cse_thumbnail': [{'src': 'https://encrypted-tbn0.gstatic.com/images?q=tbn:ANd9GcQgjzEVnwXtnat7i8-58ELgaki3uXzYZaLd3MN_SBDkY3ZtPwLOsY1sd_k&s', 'width': '252', 'height': '200'}], 'metatags': [{'og:image': 'https://www.godoycruz.gob.ar/wp-content/uploads/2025/04/Arizu-expo-winw-2025-portada.png', 'og:type': 'article', 'article:section': 'Destacado', 'article:published_time': '2025-04-23T10:58:39+00:00', 'og:image:width': '788', 'twitter:card': 'summary', 'twitter:title': 'Godoy Cruz será epicentro mundial del vino con Vinexpo Explorer Mendoza 2025 - Godoy Cruz', 'og:site_name': 'Godoy Cruz', 'tec-api-origin': 'https://www.godoycruz.gob.ar', 'og:title': 'Godoy Cruz será epicentro mundial del vino con Vinexpo Explorer Mendoza 2025 - Godoy Cruz', 'og:image:height': '624', 'og:updated_time': '2025-10-01T10:38:18+00:00', 'msapplication-tileimage': 'https://www.godoycruz.gob.ar/wp-content/uploads/2024/10/cropped-cropped-faviconN-512x512-270x270.png', 'twitter:image': 'https://www.godoycruz.gob.ar/wp-content/uploads/2025/04/Arizu-expo-winw-2025-portada.png', 'article:tag': 'con identidad vitivinícola y visión global', 'article:modified_time': '2025-10-01T10:38:18+00:00', 'viewport': 'width=device-width, initial-scale=1', 'og:locale': 'es_ES', 'og:url': 'https://www.godoycruz.gob.ar/godoy-cruz-sera-epicentro-mundial-del-vino-vinexpo-explorer-mendoza-2025/', 'tec-api-version': 'v1'}], 'cse_image': [{'src': 'https://www.godoycruz.gob.ar/wp-content/uploads/2025/04/Arizu-expo-winw-2025-portada.png'}]};;
customsearch#result;Genética, Sociedad e Identidad: raíces que unen (2025) - Facultad ...;Genética, Sociedad e Identidad: raíces que unen (<b>2025</b>) - Facultad ...;https://fcm.uncuyo.edu.ar/genetica-sociedad-e-identidad-raices-que-unen-2025;fcm.uncuyo.edu.ar;Propone el trabajar conjunto del Laboratorio de Análisis de ADN de la FCM UNCUYO con el Colectivo Mendoza por la Verdad (Mendoza) y la ONG Encontrarnos (Buenos ...;"Propone el trabajar conjunto del Laboratorio de Análisis de ADN de la FCM UNCUYO con el Colectivo <b>Mendoza</b> por la Verdad (<b>Mendoza</b>) y la ONG Encontrarnos (Buenos&nbsp;...";https://fcm.uncuyo.edu.ar/genetica-sociedad-e-identidad-raices-que-unen-2...;https://fcm.uncuyo.edu.ar/genetica-sociedad-e-identidad-raices-que-unen-<b>2</b>...;{'cse_thumbnail': [{'src': 'https://encrypted-tbn0.gstatic.com/images?q=tbn:ANd9GcSvjMOo4qx2_CNBPcZh2LL96rS7b_iYQNOptWfpBIAKWirHnppuLmYIu08&s', 'width': '310', 'height': '163'}], 'metatags': [{'msapplication-tilecolor': '#263238', 'og:image': 'https://fcm.uncuyo.edu.ar/cache/8235544c2d838e34d6fddae890ece197_315_600_c.jpg', 'og:type': 'website', 'twitter:card': 'summary_large_image', 'twitter:title': 'Genética, Sociedad e Identidad: raíces que unen (2025)', 'theme-color': '#263238', 'og:site_name': 'Facultad de Ciencias Médicas de la UNCUYO', 'author': 'Facultad de Ciencias Médicas de la UNCUYO', 'og:title': 'Genética, Sociedad e Identidad: raíces que unen (2025)', 'msapplication-tileimage': 'https://prueba.uncuyo.edu.ar/modular_4/mstile-144x144.png', 'og:description': 'Se trata de un proyecto evaluado y de financiamiento aprobado en la 17ma Convocatoria del Programa Mauricio López. Propone el trabajar conjunto del Laboratorio de Análisis de ADN de la FCM UNCUYO con el Colectivo Mendoza por la Verdad (Mendoza) y la ONG Encontrarnos (Buenos Aires), con el fin de colaborar en la investigación de la identidad de origen de personas, a partir de la aplicación de la Genética Forense y la Genealogía forense.', 'twitter:creator': 'Facultad de Ciencias Médicas de la UNCUYO', 'twitter:image:src': 'https://fcm.uncuyo.edu.ar/cache/8235544c2d838e34d6fddae890ece197_315_600_c.jpg', 'fb:app_id': '220667188060569', 'twitter:site': 'Facultad de Ciencias Médicas de la UNCUYO', 'viewport': 'width=device-width, initial-scale=1', 'twitter:description': 'Se trata de un proyecto evaluado y de financiamiento aprobado en la 17ma Convocatoria del Programa Mauricio López. Propone el trabajar ...', 'og:url': 'https://fcm.uncuyo.edu.ar/genetica-sociedad-e-identidad-raices-que-unen-2025'}], 'cse_image': [{'src': 'https://fcm.uncuyo.edu.ar/cache/8235544c2d838e34d6fddae890ece197_315_600_c.jpg'}]};;
customsearch#result;XVI Jornadas Interdisciplinarias de Estudios sobre las Mujeres y XIV ...;XVI Jornadas Interdisciplinarias de Estudios sobre las Mujeres y XIV ...;https://ffyl.uncuyo.edu.ar/cursos/item/xvi-jornadas-interdisciplinarias-de-estudios-sobre-las-mujeres-y-xiv-jornadas-internacionales-de-estudios-sobre-la-mujer-medieval-celebrando-sororidades-espacios-de-experiencias-y-horizontes-de-expectativas;ffyl.uncuyo.edu.ar;El Centro Interdisciplinario de Estudios de las Mujeres (CIEM) es el primer Centro de investigación de la Universidad Nacional de Cuyo (UNCuyo, Mendoza, ...;"El Centro Interdisciplinario de Estudios de las Mujeres (CIEM) es el primer Centro de investigación de la Universidad Nacional de Cuyo (UNCuyo, <b>Mendoza</b>,&nbsp;...";https://ffyl.uncuyo.edu.ar/.../xvi-jornadas-interdisciplinarias-de-estudios-so...;https://ffyl.uncuyo.edu.ar/.../xvi-jornadas-interdisciplinarias-de-estudios-so...;"{'cse_thumbnail': [{'src': 'https://encrypted-tbn0.gstatic.com/images?q=tbn:ANd9GcToHFPWDwSLpI1jKDnShsEAtSMU6LK-PieWcnVbANdOWLaabtHQf9Iz598&s', 'width': '310', 'height': '163'}], 'metatags': [{'msapplication-tilecolor': '#263238', 'og:image': 'https://ffyl.uncuyo.edu.ar/cache/95dde8d4bf99aa4248bfb66b2d01ed22_315_600_c.jpg', 'og:type': 'website', 'twitter:card': 'summary_large_image', 'twitter:title': 'XVI Jornadas Interdisciplinarias de Estudios sobre las Mujeres y XIV Jornadas Internacionales de Estudios sobre la Mujer Medieval ""Celebrando sororidades: espacios de experiencias y horizontes de expectativas""', 'theme-color': '#263238', 'og:site_name': 'Facultad de Filosofía y Letras', 'author': 'Facultad de Filosofía y Letras', 'og:title': 'XVI Jornadas Interdisciplinarias de Estudios sobre las Mujeres y XIV Jornadas Internacionales de Estudios sobre la Mujer Medieval ""Celebrando sororidades: espacios de experiencias y horizontes de expectativas""', 'msapplication-tileimage': 'https://prueba.uncuyo.edu.ar/modular_4/mstile-144x144.png', 'og:description': 'Se realizarán desde el 13 al 16 de mayo en la FFyL de la UNCUYO, de 09:00 a 20:00. Tendrán modalidad híbrida, es decir que se desarrollarán actividades en el lugar y otras mediadas por plataforma, especialmente las Plenarias, sesiones de comunicaciones y/o simposios-paneles. Están destinadas a la comunidad académica y público en general.', 'twitter:creator': 'Facultad de Filosofía y Letras', 'twitter:image:src': 'https://ffyl.uncuyo.edu.ar/cache/95dde8d4bf99aa4248bfb66b2d01ed22_315_600_c.jpg', 'fb:app_id': '220667188060569', 'twitter:site': 'Facultad de Filosofía y Letras', 'viewport': 'width=device-width, initial-scale=1', 'twitter:description': 'Se realizarán desde el 13 al 16 de mayo en la FFyL de la UNCUYO, de 09:00 a 20:00. Tendrán modalidad híbrida, es decir que se desarrollarán ...', 'og:url': 'https://ffyl.uncuyo.edu.ar/cursos/item/xvi-jornadas-interdisciplinarias-de-estudios-sobre-las-mujeres-y-xiv-jornadas-internacionales-de-estudios-sobre-la-mujer-medieval-celebrando-sororidades-espacios-de-experiencias-y-horizontes-de-expectativas'}], 'cse_image': [{'src': 'https://ffyl.uncuyo.edu.ar/cache/95dde8d4bf99aa4248bfb66b2d01ed22_315_600_c.jpg'}]}";;
customsearch#result;Aprendizaje integral. Parasitosis como oportunidad (2025 ...;Aprendizaje integral. Parasitosis como oportunidad (<b>2025</b> ...;https://fcm.uncuyo.edu.ar/aprendizaje-integral-parasitosis-como-oportunidad;fcm.uncuyo.edu.ar;... Mendoza, con una comunidad compuesta por aproximadamente 600 personas. imagen Aprendizaje integral. Parasitosis como oportunidad (2025). Surge como una ...;"... <b>Mendoza</b>, con una comunidad compuesta por aproximadamente 600 personas. imagen Aprendizaje integral. Parasitosis como oportunidad (<b>2025</b>). Surge como una&nbsp;...";https://fcm.uncuyo.edu.ar/aprendizaje-integral-parasitosis-como-oportunidad;https://fcm.uncuyo.edu.ar/aprendizaje-integral-parasitosis-como-oportunidad;{'cse_thumbnail': [{'src': 'https://encrypted-tbn0.gstatic.com/images?q=tbn:ANd9GcT5hEirJA8RcIXdZ9Q24i1gM26IbzRWhfPyiQ9_0gXRdnTnegD9R5BT1Sg3&s', 'width': '310', 'height': '163'}], 'metatags': [{'msapplication-tilecolor': '#263238', 'og:image': 'https://fcm.uncuyo.edu.ar/cache/8ff932f6839a039ff7e05745ef9191f1_315_600_c.jpg', 'og:type': 'website', 'twitter:card': 'summary_large_image', 'twitter:title': 'Aprendizaje integral. Parasitosis como oportunidad (2025)', 'theme-color': '#263238', 'og:site_name': 'Facultad de Ciencias Médicas de la UNCUYO', 'author': 'Facultad de Ciencias Médicas de la UNCUYO', 'og:title': 'Aprendizaje integral. Parasitosis como oportunidad (2025)', 'msapplication-tileimage': 'https://prueba.uncuyo.edu.ar/modular_4/mstile-144x144.png', 'og:description': 'Se trata de un proyecto evaluado y de financiamiento aprobado en la 17ma Convocatoria del Programa Mauricio López. Centra su accionar en el distrito de Colonia Italia del departamento de Lavalle, a 50 kms de la ciudad de Mendoza, con una comunidad compuesta por aproximadamente 600 personas.', 'twitter:creator': 'Facultad de Ciencias Médicas de la UNCUYO', 'twitter:image:src': 'https://fcm.uncuyo.edu.ar/cache/8ff932f6839a039ff7e05745ef9191f1_315_600_c.jpg', 'fb:app_id': '220667188060569', 'twitter:site': 'Facultad de Ciencias Médicas de la UNCUYO', 'viewport': 'width=device-width, initial-scale=1', 'twitter:description': 'Se trata de un proyecto evaluado y de financiamiento aprobado en la 17ma Convocatoria del Programa Mauricio López. Centra su accionar en el ...', 'og:url': 'https://fcm.uncuyo.edu.ar/aprendizaje-integral-parasitosis-como-oportunidad'}], 'cse_image': [{'src': 'https://fcm.uncuyo.edu.ar/cache/8ff932f6839a039ff7e05745ef9191f1_315_600_c.jpg'}]};;
customsearch#result;Día de la Cardiología Argentina - Facultad de Ciencias Médicas de ...;Día de la Cardiología Argentina - Facultad de Ciencias Médicas de ...;https://fcm.uncuyo.edu.ar/dia-de-la-cardiologia-argentina;fcm.uncuyo.edu.ar;9 abr 2025 ... Su primera Comisión Directiva estaba formada por los doctores Antonio Battro y Pedro Cossio como secretarios, Blas Moia y Alberto Taquini ...;"9 abr 2025 <b>...</b> Su primera Comisión Directiva estaba formada por los doctores Antonio Battro y Pedro Cossio como secretarios, Blas Moia y Alberto Taquini&nbsp;...";https://fcm.uncuyo.edu.ar/dia-de-la-cardiologia-argentina;https://fcm.uncuyo.edu.ar/dia-de-la-cardiologia-argentina;{'metatags': [{'msapplication-tilecolor': '#263238', 'og:type': 'website', 'twitter:card': 'summary_large_image', 'twitter:title': 'Día de la Cardiología Argentina', 'theme-color': '#263238', 'og:site_name': 'Facultad de Ciencias Médicas de la UNCUYO', 'author': 'Facultad de Ciencias Médicas de la UNCUYO', 'og:title': 'Día de la Cardiología Argentina', 'msapplication-tileimage': 'https://prueba.uncuyo.edu.ar/modular_4/mstile-144x144.png', 'og:description': 'Institución de Educación Superior perteneciente a la Universidad Nacional de Cuyo, que forma profesionales de la salud en distintas especialidades, niveles y ramas del saber médico', 'twitter:creator': 'Facultad de Ciencias Médicas de la UNCUYO', 'fb:app_id': '220667188060569', 'twitter:site': 'Facultad de Ciencias Médicas de la UNCUYO', 'viewport': 'width=device-width, initial-scale=1', 'twitter:description': 'Institución de Educación Superior perteneciente a la Universidad Nacional de Cuyo, que forma profesionales de la salud en distintas ...', 'og:url': 'https://fcm.uncuyo.edu.ar/dia-de-la-cardiologia-argentina'}]};;
customsearch#result;Ingreso a Carreras - Facultad de Ciencias Médicas de la UNCUYO;Ingreso a Carreras - Facultad de Ciencias Médicas de la UNCUYO;https://fcm.uncuyo.edu.ar/categorias/index/ingreso;fcm.uncuyo.edu.ar;La PREINSCRIPCIÓN al ciclo lectivo 2026 de las carreras de MEDICINA, LICENCIATURA EN ENFERMERÍA y TECNICATURAS ... imagen Se abren las inscripciones 2025 al ...;"La PREINSCRIPCIÓN al ciclo lectivo 2026 de las carreras de MEDICINA, LICENCIATURA EN ENFERMERÍA y TECNICATURAS ... imagen Se abren las inscripciones <b>2025</b> al&nbsp;...";https://fcm.uncuyo.edu.ar/categorias/index/ingreso;https://fcm.uncuyo.edu.ar/categorias/index/ingreso;{'cse_thumbnail': [{'src': 'https://encrypted-tbn0.gstatic.com/images?q=tbn:ANd9GcR8a_MJouJo8I-CH3bJ28D3I70ATmWxrwFCuVrKtMTkFZC4TudxHh1oKB0&s', 'width': '299', 'height': '169'}], 'metatags': [{'msapplication-tilecolor': '#263238', 'og:type': 'website', 'twitter:card': 'summary_large_image', 'twitter:title': 'Ingreso a Carreras', 'theme-color': '#263238', 'og:site_name': 'Facultad de Ciencias Médicas de la UNCUYO', 'author': 'Facultad de Ciencias Médicas de la UNCUYO', 'og:title': 'Ingreso a Carreras', 'msapplication-tileimage': 'https://prueba.uncuyo.edu.ar/modular_4/mstile-144x144.png', 'og:description': 'Institución de Educación Superior perteneciente a la Universidad Nacional de Cuyo, que forma profesionales de la salud en distintas especialidades, niveles y ramas del saber médico', 'twitter:creator': 'Facultad de Ciencias Médicas de la UNCUYO', 'fb:app_id': '220667188060569', 'twitter:site': 'Facultad de Ciencias Médicas de la UNCUYO', 'viewport': 'width=device-width, initial-scale=1', 'twitter:description': 'Institución de Educación Superior perteneciente a la Universidad Nacional de Cuyo, que forma profesionales de la salud en distintas ...', 'og:url': 'https://fcm.uncuyo.edu.ar/categorias/index/ingreso'}], 'cse_image': [{'src': 'https://fcm.uncuyo.edu.ar/cache/6de76bd49eb4d231aa5e361163d2886a_359_636_c.jpg'}]};;
customsearch#result;"Resultados para ""2026""";"Resultados para &quot;2026&quot;";https://fcm.uncuyo.edu.ar/buscar_tag/index/?tag=2026;fcm.uncuyo.edu.ar;Se abren las preinscripciones al Ciclo de Licenciatura en Higiene y Seguridad en el Trabajo 2026. Hasta las13 hs del 22 de agosto de 2025 será posible completar ...;"Se abren las preinscripciones al Ciclo de Licenciatura en Higiene y Seguridad en el Trabajo 2026. Hasta las13 hs del 22 de agosto de <b>2025</b> será posible completar&nbsp;...";https://fcm.uncuyo.edu.ar/buscar_tag/index/?tag=2026;https://fcm.uncuyo.edu.ar/buscar_tag/index/?tag=2026;{'metatags': [{'msapplication-tilecolor': '#263238', 'og:type': 'website', 'twitter:card': 'summary_large_image', 'twitter:title': 'Facultad de Ciencias Médicas de la UNCUYO', 'theme-color': '#263238', 'og:site_name': 'Facultad de Ciencias Médicas de la UNCUYO', 'author': 'Facultad de Ciencias Médicas de la UNCUYO', 'og:title': 'Facultad de Ciencias Médicas de la UNCUYO', 'msapplication-tileimage': 'https://prueba.uncuyo.edu.ar/modular_4/mstile-144x144.png', 'og:description': 'Institución de Educación Superior perteneciente a la Universidad Nacional de Cuyo, que forma profesionales de la salud en distintas especialidades, niveles y ramas del saber médico', 'twitter:creator': 'Facultad de Ciencias Médicas de la UNCUYO', 'fb:app_id': '220667188060569', 'twitter:site': 'Facultad de Ciencias Médicas de la UNCUYO', 'viewport': 'width=device-width, initial-scale=1', 'twitter:description': 'Institución de Educación Superior perteneciente a la Universidad Nacional de Cuyo, que forma profesionales de la salud en distintas ...', 'og:url': 'https://fcm.uncuyo.edu.ar/buscar_tag/index'}]};;
