kind;title;htmlTitle;link;displayLink;snippet;htmlSnippet;formattedUrl;htmlFormattedUrl;pagemap;mime;fileFormat
customsearch#result;8 abril, 2025 – mendoza.edu.ar;8 abril, <b>2025</b> – <b>mendoza</b>.edu.ar;https://www.mendoza.edu.ar/2025/04/08/;www.mendoza.edu.ar;8 abr 2025 ... Memorándum 45-Primaria. Cuarto encuentro virtual de propuesta de alfabetización a docentes de Cohorte I (2025). Dirigido a: Inspección Técnica ...;"8 abr 2025 <b>...</b> Memorándum 45-Primaria. Cuarto <b>encuentro</b> virtual de propuesta de alfabetización a docentes de Cohorte I (<b>2025</b>). Dirigido a: Inspección Técnica&nbsp;...";https://www.mendoza.edu.ar/2025/04/08/;https://www.<b>mendoza</b>.edu.ar/<b>2025</b>/04/08/;{'metatags': [{'viewport': 'width=device-width, initial-scale=1', 'dlm-version': '5.1.6'}]};;
customsearch#result;Música Clásica por los caminos del vino 2025 ya está en marcha ...;Música Clásica por los caminos del vino <b>2025</b> ya está en marcha ...;https://www.mendoza.gov.ar/prensa/musica-clasica-por-los-caminos-del-vino-2025-ya-esta-en-marcha/;www.mendoza.gov.ar;13 abr 2025 ... Este año el festival celebra el 25º aniversario de su creación y es organizado por el Gobierno de Mendoza, a través de la Subsecretaría de ...;"13 abr 2025 <b>...</b> Este año el festival celebra el 25º aniversario de su creación y es organizado por el Gobierno de <b>Mendoza</b>, a través de la Subsecretaría de&nbsp;...";https://www.mendoza.gov.ar/.../musica-clasica-por-los-caminos-del-vino-2...;https://www.<b>mendoza</b>.gov.ar/.../musica-clasica-por-los-caminos-del-vino-<b>2</b>...;{'metatags': [{'viewport': 'width=device-width, initial-scale=1.0'}]};;
customsearch#result;Nueva fecha para la Audiencia Pública de Malargüe Distrito Minero ...;Nueva fecha para la Audiencia Pública de Malargüe Distrito Minero ...;https://www.mendoza.gov.ar/prensa/nueva-fecha-para-la-audiencia-publica-de-malargue-distrito-minero-occidental-ii/;www.mendoza.gov.ar;9 abr 2025 ... La Autoridad Ambiental Minera le solicitó al proponente Impulsa Mendoza Sostenible la realización de talleres a realizarse en la comunidad de ...;"9 abr 2025 <b>...</b> La Autoridad Ambiental Minera le solicitó al proponente Impulsa <b>Mendoza</b> Sostenible la realización de talleres a realizarse en la comunidad de&nbsp;...";https://www.mendoza.gov.ar/.../nueva-fecha-para-la-audiencia-publica-de-...;https://www.<b>mendoza</b>.gov.ar/.../nueva-fecha-para-la-audiencia-publica-de-...;{'metatags': [{'viewport': 'width=device-width, initial-scale=1.0'}]};;
customsearch#result;24 abril, 2025 – mendoza.edu.ar;24 abril, <b>2025</b> – <b>mendoza</b>.edu.ar;https://www.mendoza.edu.ar/2025/04/24/;www.mendoza.edu.ar;24 abr 2025 ... La Coordinación de Educación Artística, invita a participar del 2° Encuentro provincial de teatro breve “Experiencias Escénicas en Contexto”. La ...;"24 abr 2025 <b>...</b> La Coordinación de Educación Artística, invita a participar del 2° <b>Encuentro</b> provincial de teatro breve “Experiencias Escénicas en Contexto”. La&nbsp;...";https://www.mendoza.edu.ar/2025/04/24/;https://www.<b>mendoza</b>.edu.ar/<b>2025</b>/04/24/;{'metatags': [{'viewport': 'width=device-width, initial-scale=1', 'dlm-version': '5.1.6'}]};;
customsearch#result;Mendoza consolida su rol en el Consejo Federal de Seguridad Vial ...;<b>Mendoza</b> consolida su rol en el Consejo Federal de Seguridad Vial ...;https://www.mendoza.gov.ar/prensa/mendoza-consolida-su-rol-en-el-consejo-federal-de-seguridad-vial/;www.mendoza.gov.ar;28 abr 2025 ... Mendoza logró un lugar en la mesa directiva a través de la designación de Orlando Corvalán como secretario administrativo. El encuentro ...;"28 abr 2025 <b>...</b> <b>Mendoza</b> logró un lugar en la mesa directiva a través de la designación de Orlando Corvalán como secretario administrativo. El <b>encuentro</b>&nbsp;...";https://www.mendoza.gov.ar/.../mendoza-consolida-su-rol-en-el-consejo-fe...;https://www.<b>mendoza</b>.gov.ar/.../<b>mendoza</b>-consolida-su-rol-en-el-consejo-fe...;{'metatags': [{'viewport': 'width=device-width, initial-scale=1.0'}]};;
customsearch#result;Los recomendados para este fin de semana - Gobierno de Mendoza;Los recomendados para este fin de semana - Gobierno de <b>Mendoza</b>;https://www.mendoza.gov.ar/prensa/los-recomendados-para-este-fin-de-semana-2/;www.mendoza.gov.ar;24 DE ABRIL, 2025. La Subsecretaría de Cultura acerca un detalle de todo lo que se puede disfrutar desde hoy jueves al domingo, en los distintos espacios ...;"24 DE ABRIL, <b>2025</b>. La Subsecretaría de Cultura acerca un detalle de todo lo que se puede disfrutar desde hoy jueves al domingo, en los distintos espacios&nbsp;...";https://www.mendoza.gov.ar/.../los-recomendados-para-este-fin-de-semana-...;https://www.<b>mendoza</b>.gov.ar/.../los-recomendados-para-este-fin-de-semana-...;{'metatags': [{'viewport': 'width=device-width, initial-scale=1.0'}]};;
customsearch#result;Se lanza la VIII edición del Festival Audiovisual Latinoamericano ...;Se lanza la VIII edición del Festival Audiovisual Latinoamericano ...;https://www.mendoza.gov.ar/prensa/se-lanza-la-viii-edicion-del-festival-audiovisual-latinoamericano-ser-voz-las-historias-cobran-vida/;www.mendoza.gov.ar;27 DE ABRIL, 2025. Esta nueva propuesta busca incentivar la lectura y la identidad cultural mendocina a través del cine, invitando a las escuelas de nivel ...;"27 DE ABRIL, <b>2025</b>. Esta nueva propuesta busca incentivar la lectura y la identidad cultural mendocina a través del cine, invitando a las escuelas de nivel&nbsp;...";https://www.mendoza.gov.ar/.../se-lanza-la-viii-edicion-del-festival-audiovi...;https://www.<b>mendoza</b>.gov.ar/.../se-lanza-la-viii-edicion-del-festival-audiovi...;{'cse_thumbnail': [{'src': 'https://encrypted-tbn0.gstatic.com/images?q=tbn:ANd9GcSvsP-ZkKmtUM30w_mK_vnipUBI1EOcXip5uwj0VI-p6ZElqFh2XvpQWgbs&s', 'width': '275', 'height': '183'}], 'metatags': [{'viewport': 'width=device-width, initial-scale=1.0'}], 'cse_image': [{'src': 'https://www.mendoza.gov.ar/wp-content/uploads/sites/5/2025/04/lanzamiento-8-festival-ser-voz_ceartistica-4-1-700x467.jpeg'}]};;
customsearch#result;Memorándum 46-Sub.Educación. Articulación con el Instituto ...;Memorándum 46-Sub.Educación. Articulación con el Instituto ...;https://www.mendoza.edu.ar/memrandum-46-politicas-educativas-informar-a-los-directores-la-posibilidad-de-articular-con-el-instituto-confucio-de-la-universidad-de-congreso-2025/;www.mendoza.edu.ar;3 abr 2025 ... Boletín oficial de Mendoza · Normativa de Argentina · Leyes ... Articulación con el Instituto Confucio – Universidad de Congreso (2025) ...;"3 abr 2025 <b>...</b> Boletín oficial de <b>Mendoza</b> &middot; Normativa de Argentina &middot; Leyes ... Articulación con el Instituto Confucio – Universidad de <b>Congreso</b> (<b>2025</b>)&nbsp;...";https://www.mendoza.edu.ar/memrandum-46-politicas-educativas-informar...;https://www.<b>mendoza</b>.edu.ar/memrandum-46-politicas-educativas-informar...;{'metatags': [{'og:image': 'https://www.mendoza.edu.ar/wp-content/uploads/2024/10/normativa-e1755614909181.jpg', 'og:type': 'article', 'viewport': 'width=device-width, initial-scale=1', 'og:title': 'Memorándum 46-Sub.Educación. Articulación con el Instituto Confucio – Universidad de Congreso (2025)', 'og:url': 'https://www.mendoza.edu.ar/memrandum-46-politicas-educativas-informar-a-los-directores-la-posibilidad-de-articular-con-el-instituto-confucio-de-la-universidad-de-congreso-2025/', 'og:description': 'Dirigido a: Primaria, Secundaria y, Técnica y Trabajo. Informar a los Directores la posibilidad de articular con e l Instituto Confucio de la Universidad de Congreso', 'dlm-version': '5.1.6'}]};;
customsearch#result;Se hará en Mendoza el Congreso Internacional sobre ...;Se hará en <b>Mendoza</b> el <b>Congreso</b> Internacional sobre ...;https://www.mendoza.gov.ar/prensa/se-hara-en-mendoza-el-congreso-internacional-sobre-regionalizacion-gobernanza-y-desarrollo/;www.mendoza.gov.ar;17 DE ABRIL, 2025. Servirá como centro de debate y desarrollo de propuestas concretas para implementar procesos de regionalización en Mendoza.;17 DE ABRIL, <b>2025</b>. Servirá como centro de debate y desarrollo de propuestas concretas para implementar procesos de regionalización en <b>Mendoza</b>.;https://www.mendoza.gov.ar/.../se-hara-en-mendoza-el-congreso-internacio...;https://www.<b>mendoza</b>.gov.ar/.../se-hara-en-<b>mendoza</b>-el-<b>congreso</b>-internacio...;{'cse_thumbnail': [{'src': 'https://encrypted-tbn0.gstatic.com/images?q=tbn:ANd9GcT_cQiHxQdcarFYRJPml-fhN_vBolFvw4l_UM2kdekBik3qbT7nuPII_3Ad&s', 'width': '291', 'height': '173'}], 'metatags': [{'viewport': 'width=device-width, initial-scale=1.0'}], 'cse_image': [{'src': 'https://www.mendoza.gov.ar/wp-content/uploads/sites/5/2025/04/mapa-2-700x417.jpg'}]};;
customsearch#result;Mendoza es sede del primer Congreso Internacional de ...;<b>Mendoza</b> es sede del primer <b>Congreso</b> Internacional de ...;https://www.mendoza.gov.ar/prensa/mendoza-es-sede-del-primer-congreso-internacional-de-emprendedurismo/;www.mendoza.gov.ar;14 DE ABRIL, 2025. Bajo el lema Formación, investigación y desarrollo, la iniciativa reúne a empresarios, académicos, emprendedores y estudiantes para ...;"14 DE ABRIL, <b>2025</b>. Bajo el lema Formación, investigación y desarrollo, la iniciativa reúne a empresarios, académicos, emprendedores y estudiantes para&nbsp;...";https://www.mendoza.gov.ar/.../mendoza-es-sede-del-primer-congreso-inter...;https://www.<b>mendoza</b>.gov.ar/.../<b>mendoza</b>-es-sede-del-primer-<b>congreso</b>-inter...;{'metatags': [{'viewport': 'width=device-width, initial-scale=1.0'}]};;
customsearch#result;Mendoza: Comisiones Académicas de Abogacía 2025 - Universidad ...;<b>Mendoza</b>: Comisiones Académicas de Abogacía <b>2025</b> - Universidad ...;https://www.ucongreso.edu.ar/mendoza-comisiones-academicas-de-abogacia-2025/;www.ucongreso.edu.ar;14 abr 2025 ... La Facultad de Ciencias Jurídicas de la Universidad de Congreso, en todas sus Sedes, Comisiones Académicas Extensión de Abogacía.;14 abr 2025 <b>...</b> La Facultad de Ciencias Jurídicas de la Universidad de <b>Congreso</b>, en todas sus Sedes, Comisiones Académicas Extensión de Abogacía.;https://www.ucongreso.edu.ar/mendoza-comisiones-academicas-de-abogaci...;https://www.u<b>congreso</b>.edu.ar/<b>mendoza</b>-comisiones-academicas-de-abogaci...;{'cse_thumbnail': [{'src': 'https://encrypted-tbn0.gstatic.com/images?q=tbn:ANd9GcR3e8kpcs2zCVsqxdsDAS8Ontyosew1Brl664jWgLfNa2RSSNOILdxlTfRz&s', 'width': '201', 'height': '251'}], 'metatags': [{'og:image': 'http://www.ucongreso.edu.ar/wp-content/uploads/2025/04/Flyer_2025_-Comisiones_Abogacia-01-scaled.jpg', 'article:published_time': '2025-04-14T17:41:18+00:00', 'og:image:width': '2048', 'twitter:card': 'summary_large_image', 'theme-color': '#7BA839', 'og:site_name': 'Universidad de Congreso', 'tec-api-origin': 'https://www.ucongreso.edu.ar', 'twitter:label1': 'Written by', 'twitter:label2': 'Est. reading time', 'msapplication-tileimage': 'https://www.ucongreso.edu.ar/wp-content/themes/ucongreso/favicons/ms-icon-144x144.png', 'og:description': 'La Facultad de Ciencias Jurídicas de la Universidad de Congreso, en todas sus Sedes, Comisiones Académicas Extensión de Abogacía.', 'twitter:creator': '@ucongreso', 'article:publisher': 'https://www.facebook.com/universidadcongreso', 'twitter:data1': 'gaticaje', 'twitter:data2': '2 minutes', 'twitter:site': '@ucongreso', 'article:modified_time': '2025-04-15T12:01:36+00:00', 'tec-api-version': 'v1', 'msapplication-tilecolor': '#ffffff', 'og:type': 'article', 'og:title': 'Mendoza: Comisiones Académicas de Abogacía 2025 - Universidad de Congreso', 'og:image:height': '2560', 'facebook-domain-verification': 'xadv5twktycpo86aqgafo0firtwz87', 'viewport': 'width=device-width, initial-scale=1.0', 'og:locale': 'es_ES', 'og:url': 'https://www.ucongreso.edu.ar/mendoza-comisiones-academicas-de-abogacia-2025/'}], 'cse_image': [{'src': 'http://www.ucongreso.edu.ar/wp-content/uploads/2025/04/Flyer_2025_-Comisiones_Abogacia-01-scaled.jpg'}]};;
customsearch#result;Mendoza: Grupo de Lectura Psicoanalítico 2025 - Universidad de ...;<b>Mendoza</b>: Grupo de Lectura Psicoanalítico <b>2025</b> - Universidad de ...;https://www.ucongreso.edu.ar/grupo-de-lectura-psicoanalitico-2025/;www.ucongreso.edu.ar;14 abr 2025 ... La Universidad de Congreso permite que los estudiantes puedan postularse para las Becas por Rendimiento Académico.;14 abr 2025 <b>...</b> La Universidad de <b>Congreso</b> permite que los estudiantes puedan postularse para las Becas por Rendimiento Académico.;https://www.ucongreso.edu.ar/grupo-de-lectura-psicoanalitico-2025/;https://www.u<b>congreso</b>.edu.ar/grupo-de-lectura-psicoanalitico-<b>2025</b>/;{'cse_thumbnail': [{'src': 'https://encrypted-tbn0.gstatic.com/images?q=tbn:ANd9GcTUuf-bNQDm8_Vt-Wd3xUUuYzNA_ob_PhMlWO4e3mUQzmafXFi0NCI049Wh&s', 'width': '201', 'height': '251'}], 'metatags': [{'og:image': 'http://www.ucongreso.edu.ar/wp-content/uploads/2025/04/Flyer_2025_-Grupo_Lectura-02-scaled.jpg', 'article:published_time': '2025-04-14T17:14:06+00:00', 'og:image:width': '2048', 'twitter:card': 'summary_large_image', 'theme-color': '#7BA839', 'og:site_name': 'Universidad de Congreso', 'tec-api-origin': 'https://www.ucongreso.edu.ar', 'twitter:label1': 'Written by', 'twitter:label2': 'Est. reading time', 'msapplication-tileimage': 'https://www.ucongreso.edu.ar/wp-content/themes/ucongreso/favicons/ms-icon-144x144.png', 'og:description': 'Psicología invita a los estudiantes de la carrera en Sede Mendoza a participar de las lecturas de los seminarios y escritos de J. Lacan.', 'twitter:creator': '@ucongreso', 'article:publisher': 'https://www.facebook.com/universidadcongreso', 'twitter:data1': 'gaticaje', 'twitter:data2': '1 minute', 'twitter:site': '@ucongreso', 'article:modified_time': '2025-04-14T17:14:09+00:00', 'tec-api-version': 'v1', 'msapplication-tilecolor': '#ffffff', 'og:type': 'article', 'og:title': 'Mendoza: Grupo de Lectura Psicoanalítico 2025 - Universidad de Congreso', 'og:image:height': '2560', 'facebook-domain-verification': 'xadv5twktycpo86aqgafo0firtwz87', 'viewport': 'width=device-width, initial-scale=1.0', 'og:locale': 'es_ES', 'og:url': 'https://www.ucongreso.edu.ar/grupo-de-lectura-psicoanalitico-2025/'}], 'cse_image': [{'src': 'http://www.ucongreso.edu.ar/wp-content/uploads/2025/04/Flyer_2025_-Grupo_Lectura-02-scaled.jpg'}]};;
customsearch#result;Festival Cultural Internacional. Mayo 2025 - Universidad de Congreso;Festival Cultural Internacional. Mayo <b>2025</b> - Universidad de <b>Congreso</b>;https://www.ucongreso.edu.ar/festival-cultural-internacional-mayo-2025/;www.ucongreso.edu.ar;23 abr 2025 ... ... Mendoza Festival Cultural Internacional Jueves 8 de mayo de 16 a 19:30 hs. Terraza de la UC. Sede Mendoza. Vení a compartir con nosotros. ¡Van ...;"23 abr 2025 <b>...</b> ... <b>Mendoza</b> Festival Cultural Internacional Jueves 8 de mayo de 16 a 19:30 hs. Terraza de la UC. Sede <b>Mendoza</b>. Vení a compartir con nosotros. ¡Van&nbsp;...";https://www.ucongreso.edu.ar/festival-cultural-internacional-mayo-2025/;https://www.u<b>congreso</b>.edu.ar/festival-cultural-internacional-mayo-<b>2025</b>/;{'cse_thumbnail': [{'src': 'https://encrypted-tbn0.gstatic.com/images?q=tbn:ANd9GcQ3JLbynGX_WCfbZWTfqKjfstHX1aOhV5LMmcydQv03RAhCzLBfcyLZV84&s', 'width': '201', 'height': '251'}], 'metatags': [{'og:image': 'http://www.ucongreso.edu.ar/wp-content/uploads/2025/04/Flyer_2025_-Festival_Internacional-01-scaled.jpg', 'article:published_time': '2025-04-23T17:48:02+00:00', 'og:image:width': '2048', 'twitter:card': 'summary_large_image', 'theme-color': '#7BA839', 'og:site_name': 'Universidad de Congreso', 'tec-api-origin': 'https://www.ucongreso.edu.ar', 'twitter:label1': 'Written by', 'twitter:label2': 'Est. reading time', 'msapplication-tileimage': 'https://www.ucongreso.edu.ar/wp-content/themes/ucongreso/favicons/ms-icon-144x144.png', 'og:description': 'La Secretaría de Cooperación Internacional invita a la Comunidad UC para participar del Festival Cultural Internacional. El mismo tendrá lugar el día jueves 8 de mayo de 16:00 a 19:30 hs en la Terraza de la Universidad (Sede Mendoza). Los stands estarán compuestos por estudiantes de intercambios y tendrán la posibilidad de estar en contacto […]', 'twitter:creator': '@ucongreso', 'article:publisher': 'https://www.facebook.com/universidadcongreso', 'twitter:data1': 'gaticaje', 'twitter:data2': '1 minute', 'twitter:site': '@ucongreso', 'article:modified_time': '2025-04-23T17:48:05+00:00', 'tec-api-version': 'v1', 'msapplication-tilecolor': '#ffffff', 'og:type': 'article', 'og:title': 'Festival Cultural Internacional. Mayo 2025 - Universidad de Congreso', 'og:image:height': '2560', 'facebook-domain-verification': 'xadv5twktycpo86aqgafo0firtwz87', 'viewport': 'width=device-width, initial-scale=1.0', 'og:locale': 'es_ES', 'og:url': 'https://www.ucongreso.edu.ar/festival-cultural-internacional-mayo-2025/'}], 'cse_image': [{'src': 'http://www.ucongreso.edu.ar/wp-content/uploads/2025/04/Flyer_2025_-Festival_Internacional-01-scaled.jpg'}]};;
customsearch#result;CIE 2025 - Mendoza;CIE <b>2025</b> - <b>Mendoza</b>;https://www.umaza.edu.ar/landings/cie2025;www.umaza.edu.ar;La Universidad Maza celebra su 65 Aniversario con el I Congreso Internacional de Emprendedurismo: Formación, Investigación y Desarrollo, del 14 al 16 de ...;"La Universidad Maza celebra su 65 Aniversario con el I <b>Congreso</b> Internacional de Emprendedurismo: Formación, Investigación y Desarrollo, del 14 al 16 de&nbsp;...";https://www.umaza.edu.ar/landings/cie2025;https://www.umaza.edu.ar/landings/cie<b>2025</b>;{'cse_thumbnail': [{'src': 'https://encrypted-tbn0.gstatic.com/images?q=tbn:ANd9GcTJ-0hPlCqlQAtWTONBRNDlIMpxDv6Kgp7jDJen8i9M0B5aL_D7mxClJhh2&s', 'width': '345', 'height': '146'}], 'metatags': [{'og:image': 'https://www.umaza.edu.ar/archivos/images/cie--.jpg', 'viewport': 'width=device-width, initial-scale=1.0', 'author': 'Área de Comunicación Institucional - Universidad Juan Agustín Maza'}], 'cse_image': [{'src': 'https://www.umaza.edu.ar/archivos/images/cie--.jpg'}]};;
customsearch#result;La Universidad de Congreso celebró su 30° Aniversario con un ...;La Universidad de <b>Congreso</b> celebró su 30° Aniversario con un ...;https://www.ucongreso.edu.ar/la-universidad-de-congreso-celebro-su-30-aniversario-con-un-emotivo-acto-academico/;www.ucongreso.edu.ar;1 abr 2025 ... Mendoza: Fotos Acto de Colación 2025. La Universidad de Congreso felicita a los graduados 2025, en todas las Sedes de la UC, por el logro ...;"1 abr 2025 <b>...</b> <b>Mendoza</b>: Fotos Acto de Colación <b>2025</b>. La Universidad de <b>Congreso</b> felicita a los graduados <b>2025</b>, en todas las Sedes de la UC, por el logro&nbsp;...";https://www.ucongreso.edu.ar/la-universidad-de-congreso-celebro-su-30-an...;https://www.u<b>congreso</b>.edu.ar/la-universidad-de-<b>congreso</b>-celebro-su-30-an...;{'cse_thumbnail': [{'src': 'https://encrypted-tbn0.gstatic.com/images?q=tbn:ANd9GcSNC61-l9ct9-cgrtdFr84ifIGYRbtkdWmk1w883lezjrEd5UrhjDtmepJ7&s', 'width': '330', 'height': '152'}], 'metatags': [{'og:image': 'http://www.ucongreso.edu.ar/wp-content/uploads/2025/04/30-aniversario-1-scaled.jpg', 'article:published_time': '2025-04-01T18:38:54+00:00', 'og:image:width': '2560', 'twitter:card': 'summary_large_image', 'theme-color': '#7BA839', 'og:site_name': 'Universidad de Congreso', 'tec-api-origin': 'https://www.ucongreso.edu.ar', 'twitter:label1': 'Written by', 'twitter:label2': 'Est. reading time', 'msapplication-tileimage': 'https://www.ucongreso.edu.ar/wp-content/themes/ucongreso/favicons/ms-icon-144x144.png', 'og:description': '30° Aniversario con un emotivo acto académico que reunió a autoridades universitarias, docentes, estudiantes y personal administrativo.', 'twitter:creator': '@ucongreso', 'article:publisher': 'https://www.facebook.com/universidadcongreso', 'twitter:data1': 'gaticaje', 'twitter:data2': '5 minutes', 'twitter:site': '@ucongreso', 'article:modified_time': '2025-04-03T14:40:52+00:00', 'tec-api-version': 'v1', 'msapplication-tilecolor': '#ffffff', 'og:type': 'article', 'og:title': 'La Universidad de Congreso celebró su 30° Aniversario con un emotivo acto académico - Universidad de Congreso', 'og:image:height': '1183', 'facebook-domain-verification': 'xadv5twktycpo86aqgafo0firtwz87', 'viewport': 'width=device-width, initial-scale=1.0', 'og:locale': 'es_ES', 'og:url': 'https://www.ucongreso.edu.ar/la-universidad-de-congreso-celebro-su-30-aniversario-con-un-emotivo-acto-academico/'}], 'cse_image': [{'src': 'http://www.ucongreso.edu.ar/wp-content/uploads/2025/04/30-aniversario-1-scaled.jpg'}]};;
customsearch#result;Universidad de Congreso: Actualización de Aranceles - Universidad ...;Universidad de <b>Congreso</b>: Actualización de Aranceles - Universidad ...;https://www.ucongreso.edu.ar/universidad-de-congreso-actualizacion-de-aranceles/;www.ucongreso.edu.ar;7 abr 2025 ... Recomposición del 30% en los valores de las cuotas para el primer trimestre del año 2025, aplicable a todas las carreras y sedes.;7 abr 2025 <b>...</b> Recomposición del 30% en los valores de las cuotas para el primer trimestre del año <b>2025</b>, aplicable a todas las carreras y sedes.;https://www.ucongreso.edu.ar/universidad-de-congreso-actualizacion-de-ar...;https://www.u<b>congreso</b>.edu.ar/universidad-de-<b>congreso</b>-actualizacion-de-ar...;{'cse_thumbnail': [{'src': 'https://encrypted-tbn0.gstatic.com/images?q=tbn:ANd9GcRXUJE8we8ksqS3AMoheShUaOQyMrFHeXk2WY34q_uo0f3qtZ0H3uIrPhoY&s', 'width': '246', 'height': '205'}], 'metatags': [{'og:image': 'https://www.ucongreso.edu.ar/wp-content/uploads/2025/04/Frente-UC-Mendoza.jpg', 'article:published_time': '2025-04-07T16:36:47+00:00', 'og:image:width': '2268', 'twitter:card': 'summary_large_image', 'theme-color': '#7BA839', 'og:site_name': 'Universidad de Congreso', 'tec-api-origin': 'https://www.ucongreso.edu.ar', 'twitter:label1': 'Written by', 'twitter:label2': 'Est. reading time', 'msapplication-tileimage': 'https://www.ucongreso.edu.ar/wp-content/themes/ucongreso/favicons/ms-icon-144x144.png', 'og:description': 'Recomposición del 30% en los valores de las cuotas para el primer trimestre del año 2025, aplicable a todas las carreras y sedes.', 'twitter:creator': '@ucongreso', 'article:publisher': 'https://www.facebook.com/universidadcongreso', 'twitter:data1': 'gaticaje', 'twitter:data2': '1 minute', 'twitter:site': '@ucongreso', 'article:modified_time': '2025-04-08T13:38:45+00:00', 'tec-api-version': 'v1', 'msapplication-tilecolor': '#ffffff', 'og:type': 'article', 'og:title': 'Universidad de Congreso: Actualización de Aranceles - Universidad de Congreso', 'og:image:height': '1884', 'facebook-domain-verification': 'xadv5twktycpo86aqgafo0firtwz87', 'viewport': 'width=device-width, initial-scale=1.0', 'og:locale': 'es_ES', 'og:url': 'https://www.ucongreso.edu.ar/universidad-de-congreso-actualizacion-de-aranceles/'}], 'cse_image': [{'src': 'https://www.ucongreso.edu.ar/wp-content/uploads/2025/04/Frente-UC-Mendoza.jpg'}]};;
